Display console messages     = on
Generate report file         = on
Wait key press from user     = on
View x64 registers           = off
View segment selectors       = off
View x87 FPU registers       = off
View MMX registers           = off
View SSE registers           = off
View AVX256 as hex           = off
View AVX256 as doubles       = off
View AVX512 as hex           = off
View AVX512 as doubles       = off
View AVX512 predicates       = off
View memory dump             = off
Get WoW64 status             = off
Get CPUID dump               = off
Get CPUID (sub)function      = off
Get affinized CPUID dump     = on
Get affinized function       = off
Get OS context               = on
Measure TSC clock            = on
Get affinity mask            = on
Get topology                 = off
Get extended topology        = off

# 0
CPUID 00000000: 00000016-756E6547-6C65746E-49656E69
CPUID 00000001: 000A0671-00040800-DEFA2203-178BFBFF
CPUID 00000002: 00FEFF01-000000F0-00000000-00000000
CPUID 00000003: 00000000-00000000-00000000-00000000
CPUID 00000004: 0C000121-02C0003F-0000003F-00000000
CPUID 00000004: 0C000122-01C0003F-0000003F-00000000
CPUID 00000004: 0C000143-01C0003F-000003FF-00000000
CPUID 00000004: 0C000163-03C0003F-00003FFF-00000006
CPUID 00000005: 00000000-00000000-00000000-00000000
CPUID 00000006: 00000004-00000000-00000000-00000000
CPUID 00000007: 00000000-00842569-00000000-30000400
CPUID 00000008: 00000000-00000000-00000000-00000000
CPUID 00000009: 00000000-00000000-00000000-00000000
CPUID 0000000A: 00000000-00000000-00000000-00000000
CPUID 0000000B: 00000000-00000001-00000100-00000000
CPUID 0000000B: 00000002-00000004-00000201-00000000
CPUID 0000000C: 00000000-00000000-00000000-00000000
CPUID 0000000D: 00000007-00000340-00000340-00000000
CPUID 0000000D: 00000000-00000A80-00000000-00000000
CPUID 0000000D: 00000100-00000240-00000000-00000000
CPUID 0000000E: 00000000-00000000-00000000-00000000
CPUID 0000000F: 00000000-00000000-00000000-00000000
CPUID 00000010: 00000000-00000000-00000000-00000000
CPUID 00000011: 00000000-00000000-00000000-00000000
CPUID 00000012: 00000000-00000000-00000000-00000000
CPUID 00000012: 00000000-00000000-00000000-00000000
CPUID 00000013: 00000000-00000000-00000000-00000000
CPUID 00000014: 00000000-00000000-00000000-00000000
CPUID 00000015: 00000000-00000000-00000000-00000000
CPUID 00000016: 00000000-00000000-00000000-00000000
CPUID 40000000: 40000001-4B4D564B-564B4D56-0000004D
CPUID 40000001: 01000089-00000000-00000000-00000000
CPUID 80000000: 80000008-00000000-00000000-00000000
CPUID 80000001: 00000000-00000000-00000121-28100800
CPUID 80000002: 68743131-6E654720-746E4920-52286C65
CPUID 80000003: 6F432029-54286572-6920294D-31312D37
CPUID 80000004: 46303037-32204020-4730352E-00007A48
CPUID 80000005: 00000000-00000000-00000000-00000000
CPUID 80000006: 00000000-00000000-01006040-00000000
CPUID 80000007: 00000000-00000000-00000000-00000100
CPUID 80000008: 00003027-00000000-00000000-00000000

# 1
CPUID 00000000: 00000016-756E6547-6C65746E-49656E69
CPUID 00000001: 000A0671-01040800-DEFA2203-178BFBFF
CPUID 00000002: 00FEFF01-000000F0-00000000-00000000
CPUID 00000003: 00000000-00000000-00000000-00000000
CPUID 00000004: 0C000121-02C0003F-0000003F-00000000
CPUID 00000004: 0C000122-01C0003F-0000003F-00000000
CPUID 00000004: 0C000143-01C0003F-000003FF-00000000
CPUID 00000004: 0C000163-03C0003F-00003FFF-00000006
CPUID 00000005: 00000000-00000000-00000000-00000000
CPUID 00000006: 00000004-00000000-00000000-00000000
CPUID 00000007: 00000000-00842569-00000000-30000400
CPUID 00000008: 00000000-00000000-00000000-00000000
CPUID 00000009: 00000000-00000000-00000000-00000000
CPUID 0000000A: 00000000-00000000-00000000-00000000
CPUID 0000000B: 00000000-00000001-00000100-00000001
CPUID 0000000B: 00000002-00000004-00000201-00000001
CPUID 0000000C: 00000000-00000000-00000000-00000000
CPUID 0000000D: 00000007-00000340-00000340-00000000
CPUID 0000000D: 00000000-00000A80-00000000-00000000
CPUID 0000000D: 00000100-00000240-00000000-00000000
CPUID 0000000E: 00000000-00000000-00000000-00000000
CPUID 0000000F: 00000000-00000000-00000000-00000000
CPUID 00000010: 00000000-00000000-00000000-00000000
CPUID 00000011: 00000000-00000000-00000000-00000000
CPUID 00000012: 00000000-00000000-00000000-00000000
CPUID 00000012: 00000000-00000000-00000000-00000000
CPUID 00000013: 00000000-00000000-00000000-00000000
CPUID 00000014: 00000000-00000000-00000000-00000000
CPUID 00000015: 00000000-00000000-00000000-00000000
CPUID 00000016: 00000000-00000000-00000000-00000000
CPUID 40000000: 40000001-4B4D564B-564B4D56-0000004D
CPUID 40000001: 01000089-00000000-00000000-00000000
CPUID 80000000: 80000008-00000000-00000000-00000000
CPUID 80000001: 00000000-00000000-00000121-28100800
CPUID 80000002: 68743131-6E654720-746E4920-52286C65
CPUID 80000003: 6F432029-54286572-6920294D-31312D37
CPUID 80000004: 46303037-32204020-4730352E-00007A48
CPUID 80000005: 00000000-00000000-00000000-00000000
CPUID 80000006: 00000000-00000000-01006040-00000000
CPUID 80000007: 00000000-00000000-00000000-00000100
CPUID 80000008: 00003027-00000000-00000000-00000000

# 2
CPUID 00000000: 00000016-756E6547-6C65746E-49656E69
CPUID 00000001: 000A0671-02040800-DEFA2203-178BFBFF
CPUID 00000002: 00FEFF01-000000F0-00000000-00000000
CPUID 00000003: 00000000-00000000-00000000-00000000
CPUID 00000004: 0C000121-02C0003F-0000003F-00000000
CPUID 00000004: 0C000122-01C0003F-0000003F-00000000
CPUID 00000004: 0C000143-01C0003F-000003FF-00000000
CPUID 00000004: 0C000163-03C0003F-00003FFF-00000006
CPUID 00000005: 00000000-00000000-00000000-00000000
CPUID 00000006: 00000004-00000000-00000000-00000000
CPUID 00000007: 00000000-00842569-00000000-30000400
CPUID 00000008: 00000000-00000000-00000000-00000000
CPUID 00000009: 00000000-00000000-00000000-00000000
CPUID 0000000A: 00000000-00000000-00000000-00000000
CPUID 0000000B: 00000000-00000001-00000100-00000002
CPUID 0000000B: 00000002-00000004-00000201-00000002
CPUID 0000000C: 00000000-00000000-00000000-00000000
CPUID 0000000D: 00000007-00000340-00000340-00000000
CPUID 0000000D: 00000000-00000A80-00000000-00000000
CPUID 0000000D: 00000100-00000240-00000000-00000000
CPUID 0000000E: 00000000-00000000-00000000-00000000
CPUID 0000000F: 00000000-00000000-00000000-00000000
CPUID 00000010: 00000000-00000000-00000000-00000000
CPUID 00000011: 00000000-00000000-00000000-00000000
CPUID 00000012: 00000000-00000000-00000000-00000000
CPUID 00000012: 00000000-00000000-00000000-00000000
CPUID 00000013: 00000000-00000000-00000000-00000000
CPUID 00000014: 00000000-00000000-00000000-00000000
CPUID 00000015: 00000000-00000000-00000000-00000000
CPUID 00000016: 00000000-00000000-00000000-00000000
CPUID 40000000: 40000001-4B4D564B-564B4D56-0000004D
CPUID 40000001: 01000089-00000000-00000000-00000000
CPUID 80000000: 80000008-00000000-00000000-00000000
CPUID 80000001: 00000000-00000000-00000121-28100800
CPUID 80000002: 68743131-6E654720-746E4920-52286C65
CPUID 80000003: 6F432029-54286572-6920294D-31312D37
CPUID 80000004: 46303037-32204020-4730352E-00007A48
CPUID 80000005: 00000000-00000000-00000000-00000000
CPUID 80000006: 00000000-00000000-01006040-00000000
CPUID 80000007: 00000000-00000000-00000000-00000100
CPUID 80000008: 00003027-00000000-00000000-00000000

# 3
CPUID 00000000: 00000016-756E6547-6C65746E-49656E69
CPUID 00000001: 000A0671-03040800-DEFA2203-178BFBFF
CPUID 00000002: 00FEFF01-000000F0-00000000-00000000
CPUID 00000003: 00000000-00000000-00000000-00000000
CPUID 00000004: 0C000121-02C0003F-0000003F-00000000
CPUID 00000004: 0C000122-01C0003F-0000003F-00000000
CPUID 00000004: 0C000143-01C0003F-000003FF-00000000
CPUID 00000004: 0C000163-03C0003F-00003FFF-00000006
CPUID 00000005: 00000000-00000000-00000000-00000000
CPUID 00000006: 00000004-00000000-00000000-00000000
CPUID 00000007: 00000000-00842569-00000000-30000400
CPUID 00000008: 00000000-00000000-00000000-00000000
CPUID 00000009: 00000000-00000000-00000000-00000000
CPUID 0000000A: 00000000-00000000-00000000-00000000
CPUID 0000000B: 00000000-00000001-00000100-00000003
CPUID 0000000B: 00000002-00000004-00000201-00000003
CPUID 0000000C: 00000000-00000000-00000000-00000000
CPUID 0000000D: 00000007-00000340-00000340-00000000
CPUID 0000000D: 00000000-00000A80-00000000-00000000
CPUID 0000000D: 00000100-00000240-00000000-00000000
CPUID 0000000E: 00000000-00000000-00000000-00000000
CPUID 0000000F: 00000000-00000000-00000000-00000000
CPUID 00000010: 00000000-00000000-00000000-00000000
CPUID 00000011: 00000000-00000000-00000000-00000000
CPUID 00000012: 00000000-00000000-00000000-00000000
CPUID 00000012: 00000000-00000000-00000000-00000000
CPUID 00000013: 00000000-00000000-00000000-00000000
CPUID 00000014: 00000000-00000000-00000000-00000000
CPUID 00000015: 00000000-00000000-00000000-00000000
CPUID 00000016: 00000000-00000000-00000000-00000000
CPUID 40000000: 40000001-4B4D564B-564B4D56-0000004D
CPUID 40000001: 01000089-00000000-00000000-00000000
CPUID 80000000: 80000008-00000000-00000000-00000000
CPUID 80000001: 00000000-00000000-00000121-28100800
CPUID 80000002: 68743131-6E654720-746E4920-52286C65
CPUID 80000003: 6F432029-54286572-6920294D-31312D37
CPUID 80000004: 46303037-32204020-4730352E-00007A48
CPUID 80000005: 00000000-00000000-00000000-00000000
CPUID 80000006: 00000000-00000000-01006040-00000000
CPUID 80000007: 00000000-00000000-00000000-00000100
CPUID 80000008: 00003027-00000000-00000000-00000000

CPU-supported context bitmap : 0000000000000007h.
OS-enabled context bitmap    : 0000000000000007h.

Measure TSC : 2514.66 MHz.

Logical processors count : 4.
System affinity mask     : 000000000000000Fh.

