Java CPUID v3.03.06. Win64 JRE64.
https://github.com/manusov/JavaCrossPlatformCPUID
https://github.com/manusov?tab=repositories
No copyright. Information belongs to Universe.
CPUID hex dump file for one CPU.

CPUID Registers (CPU #0):
----------------------------------------------------
Function        EAX      EBX      ECX      EDX
----------------------------------------------------
CPUID 00000000: 0000001B-756E6547-6C65746E-49656E69
CPUID 00000001: 000A0671-00100800-7FFAFBBF-BFEBFBFF
CPUID 00000002: 00FEFF01-000000F0-00000000-00000000
CPUID 00000003: 00000000-00000000-00000000-00000000
CPUID 00000004: 1C004121-02C0003F-0000003F-00000000
CPUID 00000004: 1C004122-01C0003F-0000003F-00000000
CPUID 00000004: 1C004143-01C0003F-000003FF-00000000
CPUID 00000004: 1C03C163-03C0003F-00003FFF-00000006
CPUID 00000005: 00000040-00000040-00000003-11121020
CPUID 00000006: 0003EFF7-00000002-00000009-00000000
CPUID 00000007: 00000002-F2BF67EB-00405F4E-BC000410
CPUID 00000007: 00000000-00000000-00000000-00000000
CPUID 00000007: 00000000-00000000-00000000-00000001
CPUID 00000008: 00000000-00000000-00000000-00000000
CPUID 00000009: 00000000-00000000-00000000-00000000
CPUID 0000000A: 08300805-00000000-0000000F-00008604
CPUID 0000000B: 00000001-00000002-00000100-00000000
CPUID 0000000B: 00000004-00000010-00000201-00000000
CPUID 0000000C: 00000000-00000000-00000000-00000000
CPUID 0000000D: 000002FF-00000A80-00000A88-00000000
CPUID 0000000D: 0000000F-00000A80-00002100-00000000
CPUID 0000000D: 00000100-00000240-00000000-00000000
CPUID 0000000D: 00000040-000003C0-00000000-00000000
CPUID 0000000D: 00000040-00000400-00000000-00000000
CPUID 0000000D: 00000040-00000440-00000000-00000000
CPUID 0000000D: 00000200-00000480-00000000-00000000
CPUID 0000000D: 00000400-00000680-00000000-00000000
CPUID 0000000D: 00000008-00000A80-00000000-00000000
CPUID 0000000E: 00000000-00000000-00000000-00000000
CPUID 0000000F: 00000000-00000000-00000000-00000000
CPUID 00000010: 00000000-00000000-00000000-00000000
CPUID 00000011: 00000000-00000000-00000000-00000000
CPUID 00000012: 00000000-00000000-00000000-00000000
CPUID 00000012: 00000000-00000000-00000000-00000000
CPUID 00000013: 00000000-00000000-00000000-00000000
CPUID 00000014: 00000001-0000000F-00000007-00000000
CPUID 00000014: 02490002-003F1FFF-00000000-00000000
CPUID 00000015: 00000002-000000D0-016E3600-00000000
CPUID 00000016: 000009C4-00001324-00000064-00000000
CPUID 00000017: 00000000-00000000-00000000-00000000
CPUID 00000018: 00000007-00000000-00000000-00000000
CPUID 00000018: 00000000-00080007-00000001-00004122
CPUID 00000018: 00000000-0010000F-00000001-00004125
CPUID 00000018: 00000000-00040001-00000010-00004024
CPUID 00000018: 00000000-00040006-00000008-00004024
CPUID 00000018: 00000000-00080008-00000001-00004124
CPUID 00000018: 00000000-00080007-00000080-00004043
CPUID 00000018: 00000000-00080009-00000080-00004043
CPUID 00000019: 00000000-00000000-00000000-00000000
CPUID 0000001A: 00000000-00000000-00000000-00000000
CPUID 0000001B: 00000000-00000000-00000000-00000000
CPUID 80000000: 80000008-00000000-00000000-00000000
CPUID 80000001: 00000000-00000000-00000121-2C100800
CPUID 80000002: 68743131-6E654720-746E4920-52286C65
CPUID 80000003: 6F432029-54286572-6920294D-31312D37
CPUID 80000004: 46303037-32204020-4730352E-00007A48
CPUID 80000005: 00000000-00000000-00000000-00000000
CPUID 80000006: 00000000-00000000-01006040-00000000
CPUID 80000007: 00000000-00000000-00000000-00000100
CPUID 80000008: 00003027-00000000-00000000-00000000
----------------------------------------------------

