Java CPUID v3.03.06. Linux32 JRE32.
https://github.com/manusov/JavaCrossPlatformCPUID
https://github.com/manusov?tab=repositories
No copyright. Information belongs to Universe.
CPUID hex dump file for all CPUs.

CPUID Registers (CPU #0):
----------------------------------------------------
Function        EAX      EBX      ECX      EDX
----------------------------------------------------
CPUID 00000000: 00000016-756E6547-6C65746E-49656E69
CPUID 00000001: 000A0671-00040800-FEFA3203-178BFBFF
CPUID 00000002: 00FEFF01-000000F0-00000000-00000000
CPUID 00000003: 00000000-00000000-00000000-00000000
CPUID 00000004: 0C000121-02C0003F-0000003F-00000000
CPUID 00000004: 0C000122-01C0003F-0000003F-00000000
CPUID 00000004: 0C000143-01C0003F-000003FF-00000000
CPUID 00000004: 0C000163-03C0003F-00003FFF-00000006
CPUID 00000005: 00000000-00000000-00000000-00000000
CPUID 00000006: 00000004-00000000-00000000-00000000
CPUID 00000007: 00000002-208C2569-00000000-30000400
CPUID 00000007: 00000000-00000000-00000000-00000000
CPUID 00000007: 00000000-00000000-00000000-00000000
CPUID 00000008: 00000000-00000000-00000000-00000000
CPUID 00000009: 00000000-00000000-00000000-00000000
CPUID 0000000A: 00000000-00000000-00000000-00000000
CPUID 0000000B: 00000000-00000001-00000100-00000000
CPUID 0000000B: 00000002-00000004-00000201-00000000
CPUID 0000000C: 00000000-00000000-00000000-00000000
CPUID 0000000D: 00000007-00000340-00000340-00000000
CPUID 0000000D: 00000000-00000A80-00000000-00000000
CPUID 0000000D: 00000100-00000240-00000000-00000000
CPUID 0000000E: 00000000-00000000-00000000-00000000
CPUID 0000000F: 00000000-00000000-00000000-00000000
CPUID 00000010: 00000000-00000000-00000000-00000000
CPUID 00000011: 00000000-00000000-00000000-00000000
CPUID 00000012: 00000000-00000000-00000000-00000000
CPUID 00000012: 00000000-00000000-00000000-00000000
CPUID 00000013: 00000000-00000000-00000000-00000000
CPUID 00000014: 00000000-00000000-00000000-00000000
CPUID 00000015: 00000000-00000000-00000000-00000000
CPUID 00000016: 00000000-00000000-00000000-00000000
CPUID 40000000: 40000001-4B4D564B-564B4D56-0000004D
CPUID 40000001: 01000089-00000000-00000000-00000000
CPUID 80000000: 80000008-00000000-00000000-00000000
CPUID 80000001: 00000000-00000000-00000121-08100000
CPUID 80000002: 68743131-6E654720-746E4920-52286C65
CPUID 80000003: 6F432029-54286572-6920294D-31312D37
CPUID 80000004: 46303037-32204020-4730352E-00007A48
CPUID 80000005: 00000000-00000000-00000000-00000000
CPUID 80000006: 00000000-00000000-01006040-00000000
CPUID 80000007: 00000000-00000000-00000000-00000100
CPUID 80000008: 00003027-00000000-00000000-00000000
----------------------------------------------------

CPUID Registers (CPU #1):
----------------------------------------------------
Function        EAX      EBX      ECX      EDX
----------------------------------------------------
CPUID 00000000: 00000016-756E6547-6C65746E-49656E69
CPUID 00000001: 000A0671-01040800-FEFA3203-178BFBFF
CPUID 00000002: 00FEFF01-000000F0-00000000-00000000
CPUID 00000003: 00000000-00000000-00000000-00000000
CPUID 00000004: 0C000121-02C0003F-0000003F-00000000
CPUID 00000004: 0C000122-01C0003F-0000003F-00000000
CPUID 00000004: 0C000143-01C0003F-000003FF-00000000
CPUID 00000004: 0C000163-03C0003F-00003FFF-00000006
CPUID 00000005: 00000000-00000000-00000000-00000000
CPUID 00000006: 00000004-00000000-00000000-00000000
CPUID 00000007: 00000002-208C2569-00000000-30000400
CPUID 00000007: 00000000-00000000-00000000-00000000
CPUID 00000007: 00000000-00000000-00000000-00000000
CPUID 00000008: 00000000-00000000-00000000-00000000
CPUID 00000009: 00000000-00000000-00000000-00000000
CPUID 0000000A: 00000000-00000000-00000000-00000000
CPUID 0000000B: 00000000-00000001-00000100-00000001
CPUID 0000000B: 00000002-00000004-00000201-00000001
CPUID 0000000C: 00000000-00000000-00000000-00000000
CPUID 0000000D: 00000007-00000340-00000340-00000000
CPUID 0000000D: 00000000-00000A80-00000000-00000000
CPUID 0000000D: 00000100-00000240-00000000-00000000
CPUID 0000000E: 00000000-00000000-00000000-00000000
CPUID 0000000F: 00000000-00000000-00000000-00000000
CPUID 00000010: 00000000-00000000-00000000-00000000
CPUID 00000011: 00000000-00000000-00000000-00000000
CPUID 00000012: 00000000-00000000-00000000-00000000
CPUID 00000012: 00000000-00000000-00000000-00000000
CPUID 00000013: 00000000-00000000-00000000-00000000
CPUID 00000014: 00000000-00000000-00000000-00000000
CPUID 00000015: 00000000-00000000-00000000-00000000
CPUID 00000016: 00000000-00000000-00000000-00000000
CPUID 40000000: 40000001-4B4D564B-564B4D56-0000004D
CPUID 40000001: 01000089-00000000-00000000-00000000
CPUID 80000000: 80000008-00000000-00000000-00000000
CPUID 80000001: 00000000-00000000-00000121-08100000
CPUID 80000002: 68743131-6E654720-746E4920-52286C65
CPUID 80000003: 6F432029-54286572-6920294D-31312D37
CPUID 80000004: 46303037-32204020-4730352E-00007A48
CPUID 80000005: 00000000-00000000-00000000-00000000
CPUID 80000006: 00000000-00000000-01006040-00000000
CPUID 80000007: 00000000-00000000-00000000-00000100
CPUID 80000008: 00003027-00000000-00000000-00000000
----------------------------------------------------

CPUID Registers (CPU #2):
----------------------------------------------------
Function        EAX      EBX      ECX      EDX
----------------------------------------------------
CPUID 00000000: 00000016-756E6547-6C65746E-49656E69
CPUID 00000001: 000A0671-02040800-FEFA3203-178BFBFF
CPUID 00000002: 00FEFF01-000000F0-00000000-00000000
CPUID 00000003: 00000000-00000000-00000000-00000000
CPUID 00000004: 0C000121-02C0003F-0000003F-00000000
CPUID 00000004: 0C000122-01C0003F-0000003F-00000000
CPUID 00000004: 0C000143-01C0003F-000003FF-00000000
CPUID 00000004: 0C000163-03C0003F-00003FFF-00000006
CPUID 00000005: 00000000-00000000-00000000-00000000
CPUID 00000006: 00000004-00000000-00000000-00000000
CPUID 00000007: 00000002-208C2569-00000000-30000400
CPUID 00000007: 00000000-00000000-00000000-00000000
CPUID 00000007: 00000000-00000000-00000000-00000000
CPUID 00000008: 00000000-00000000-00000000-00000000
CPUID 00000009: 00000000-00000000-00000000-00000000
CPUID 0000000A: 00000000-00000000-00000000-00000000
CPUID 0000000B: 00000000-00000001-00000100-00000002
CPUID 0000000B: 00000002-00000004-00000201-00000002
CPUID 0000000C: 00000000-00000000-00000000-00000000
CPUID 0000000D: 00000007-00000340-00000340-00000000
CPUID 0000000D: 00000000-00000A80-00000000-00000000
CPUID 0000000D: 00000100-00000240-00000000-00000000
CPUID 0000000E: 00000000-00000000-00000000-00000000
CPUID 0000000F: 00000000-00000000-00000000-00000000
CPUID 00000010: 00000000-00000000-00000000-00000000
CPUID 00000011: 00000000-00000000-00000000-00000000
CPUID 00000012: 00000000-00000000-00000000-00000000
CPUID 00000012: 00000000-00000000-00000000-00000000
CPUID 00000013: 00000000-00000000-00000000-00000000
CPUID 00000014: 00000000-00000000-00000000-00000000
CPUID 00000015: 00000000-00000000-00000000-00000000
CPUID 00000016: 00000000-00000000-00000000-00000000
CPUID 40000000: 40000001-4B4D564B-564B4D56-0000004D
CPUID 40000001: 01000089-00000000-00000000-00000000
CPUID 80000000: 80000008-00000000-00000000-00000000
CPUID 80000001: 00000000-00000000-00000121-08100000
CPUID 80000002: 68743131-6E654720-746E4920-52286C65
CPUID 80000003: 6F432029-54286572-6920294D-31312D37
CPUID 80000004: 46303037-32204020-4730352E-00007A48
CPUID 80000005: 00000000-00000000-00000000-00000000
CPUID 80000006: 00000000-00000000-01006040-00000000
CPUID 80000007: 00000000-00000000-00000000-00000100
CPUID 80000008: 00003027-00000000-00000000-00000000
----------------------------------------------------

CPUID Registers (CPU #3):
----------------------------------------------------
Function        EAX      EBX      ECX      EDX
----------------------------------------------------
CPUID 00000000: 00000016-756E6547-6C65746E-49656E69
CPUID 00000001: 000A0671-03040800-FEFA3203-178BFBFF
CPUID 00000002: 00FEFF01-000000F0-00000000-00000000
CPUID 00000003: 00000000-00000000-00000000-00000000
CPUID 00000004: 0C000121-02C0003F-0000003F-00000000
CPUID 00000004: 0C000122-01C0003F-0000003F-00000000
CPUID 00000004: 0C000143-01C0003F-000003FF-00000000
CPUID 00000004: 0C000163-03C0003F-00003FFF-00000006
CPUID 00000005: 00000000-00000000-00000000-00000000
CPUID 00000006: 00000004-00000000-00000000-00000000
CPUID 00000007: 00000002-208C2569-00000000-30000400
CPUID 00000007: 00000000-00000000-00000000-00000000
CPUID 00000007: 00000000-00000000-00000000-00000000
CPUID 00000008: 00000000-00000000-00000000-00000000
CPUID 00000009: 00000000-00000000-00000000-00000000
CPUID 0000000A: 00000000-00000000-00000000-00000000
CPUID 0000000B: 00000000-00000001-00000100-00000003
CPUID 0000000B: 00000002-00000004-00000201-00000003
CPUID 0000000C: 00000000-00000000-00000000-00000000
CPUID 0000000D: 00000007-00000340-00000340-00000000
CPUID 0000000D: 00000000-00000A80-00000000-00000000
CPUID 0000000D: 00000100-00000240-00000000-00000000
CPUID 0000000E: 00000000-00000000-00000000-00000000
CPUID 0000000F: 00000000-00000000-00000000-00000000
CPUID 00000010: 00000000-00000000-00000000-00000000
CPUID 00000011: 00000000-00000000-00000000-00000000
CPUID 00000012: 00000000-00000000-00000000-00000000
CPUID 00000012: 00000000-00000000-00000000-00000000
CPUID 00000013: 00000000-00000000-00000000-00000000
CPUID 00000014: 00000000-00000000-00000000-00000000
CPUID 00000015: 00000000-00000000-00000000-00000000
CPUID 00000016: 00000000-00000000-00000000-00000000
CPUID 40000000: 40000001-4B4D564B-564B4D56-0000004D
CPUID 40000001: 01000089-00000000-00000000-00000000
CPUID 80000000: 80000008-00000000-00000000-00000000
CPUID 80000001: 00000000-00000000-00000121-08100000
CPUID 80000002: 68743131-6E654720-746E4920-52286C65
CPUID 80000003: 6F432029-54286572-6920294D-31312D37
CPUID 80000004: 46303037-32204020-4730352E-00007A48
CPUID 80000005: 00000000-00000000-00000000-00000000
CPUID 80000006: 00000000-00000000-01006040-00000000
CPUID 80000007: 00000000-00000000-00000000-00000100
CPUID 80000008: 00003027-00000000-00000000-00000000
----------------------------------------------------

