Java CPUID v3.06.14. Linux64 JRE64.
https://github.com/manusov/JavaCrossPlatformCPUID
https://github.com/manusov?tab=repositories
No copyright. Information belongs to Universe.
CPUID hex dump file for all CPUs.

CPUID Registers (CPU #0):
----------------------------------------------------
Function        EAX      EBX      ECX      EDX
----------------------------------------------------
CPUID 00000000: 0000000D-756E6547-6C65746E-49656E69
CPUID 00000001: 000306C3-00040800-FEFA3203-178BFBFF
CPUID 00000002: 76036301-00F0B5FF-00000000-00C10000
CPUID 00000003: 00000000-00000000-00000000-00000000
CPUID 00000004: 0C000121-01C0003F-0000003F-00000000
CPUID 00000004: 0C000122-01C0003F-0000003F-00000000
CPUID 00000004: 0C000143-01C0003F-000001FF-00000000
CPUID 00000004: 0C000163-02C0003F-00001FFF-00000006
CPUID 00000005: 00000000-00000000-00000000-00000000
CPUID 00000006: 00000004-00000000-00000000-00000000
CPUID 00000007: 00000000-00002529-00000000-10000400
CPUID 00000008: 00000000-00000000-00000000-00000000
CPUID 00000009: 00000000-00000000-00000000-00000000
CPUID 0000000A: 00000000-00000000-00000000-00000000
CPUID 0000000B: 00000000-00000001-00000100-00000000
CPUID 0000000B: 00000002-00000004-00000201-00000000
CPUID 0000000C: 00000000-00000000-00000000-00000000
CPUID 0000000D: 00000007-00000340-00000340-00000000
CPUID 0000000D: 00000000-00000000-00000000-00000000
CPUID 0000000D: 00000100-00000240-00000000-00000000
CPUID 40000000: 40000001-4B4D564B-564B4D56-0000004D
CPUID 40000001: 01000089-00000000-00000000-00000000
CPUID 80000000: 80000008-00000000-00000000-00000000
CPUID 80000001: 00000000-00000000-00000021-28100800
CPUID 80000002: 65746E49-2952286C-726F4320-4D542865
CPUID 80000003: 37692029-3037342D-20514830-20555043
CPUID 80000004: 2E322040-48473034-0000007A-00000000
CPUID 80000005: 00000000-00000000-00000000-00000000
CPUID 80000006: 00000000-00000000-01006040-00000000
CPUID 80000007: 00000000-00000000-00000000-00000100
CPUID 80000008: 00003027-00000000-00000000-00000000
----------------------------------------------------

CPUID Registers (CPU #1):
----------------------------------------------------
Function        EAX      EBX      ECX      EDX
----------------------------------------------------
CPUID 00000000: 0000000D-756E6547-6C65746E-49656E69
CPUID 00000001: 000306C3-01040800-FEFA3203-178BFBFF
CPUID 00000002: 76036301-00F0B5FF-00000000-00C10000
CPUID 00000003: 00000000-00000000-00000000-00000000
CPUID 00000004: 0C000121-01C0003F-0000003F-00000000
CPUID 00000004: 0C000122-01C0003F-0000003F-00000000
CPUID 00000004: 0C000143-01C0003F-000001FF-00000000
CPUID 00000004: 0C000163-02C0003F-00001FFF-00000006
CPUID 00000005: 00000000-00000000-00000000-00000000
CPUID 00000006: 00000004-00000000-00000000-00000000
CPUID 00000007: 00000000-00002529-00000000-10000400
CPUID 00000008: 00000000-00000000-00000000-00000000
CPUID 00000009: 00000000-00000000-00000000-00000000
CPUID 0000000A: 00000000-00000000-00000000-00000000
CPUID 0000000B: 00000000-00000001-00000100-00000001
CPUID 0000000B: 00000002-00000004-00000201-00000001
CPUID 0000000C: 00000000-00000000-00000000-00000000
CPUID 0000000D: 00000007-00000340-00000340-00000000
CPUID 0000000D: 00000000-00000000-00000000-00000000
CPUID 0000000D: 00000100-00000240-00000000-00000000
CPUID 40000000: 40000001-4B4D564B-564B4D56-0000004D
CPUID 40000001: 01000089-00000000-00000000-00000000
CPUID 80000000: 80000008-00000000-00000000-00000000
CPUID 80000001: 00000000-00000000-00000021-28100800
CPUID 80000002: 65746E49-2952286C-726F4320-4D542865
CPUID 80000003: 37692029-3037342D-20514830-20555043
CPUID 80000004: 2E322040-48473034-0000007A-00000000
CPUID 80000005: 00000000-00000000-00000000-00000000
CPUID 80000006: 00000000-00000000-01006040-00000000
CPUID 80000007: 00000000-00000000-00000000-00000100
CPUID 80000008: 00003027-00000000-00000000-00000000
----------------------------------------------------

CPUID Registers (CPU #2):
----------------------------------------------------
Function        EAX      EBX      ECX      EDX
----------------------------------------------------
CPUID 00000000: 0000000D-756E6547-6C65746E-49656E69
CPUID 00000001: 000306C3-02040800-FEFA3203-178BFBFF
CPUID 00000002: 76036301-00F0B5FF-00000000-00C10000
CPUID 00000003: 00000000-00000000-00000000-00000000
CPUID 00000004: 0C000121-01C0003F-0000003F-00000000
CPUID 00000004: 0C000122-01C0003F-0000003F-00000000
CPUID 00000004: 0C000143-01C0003F-000001FF-00000000
CPUID 00000004: 0C000163-02C0003F-00001FFF-00000006
CPUID 00000005: 00000000-00000000-00000000-00000000
CPUID 00000006: 00000004-00000000-00000000-00000000
CPUID 00000007: 00000000-00002529-00000000-10000400
CPUID 00000008: 00000000-00000000-00000000-00000000
CPUID 00000009: 00000000-00000000-00000000-00000000
CPUID 0000000A: 00000000-00000000-00000000-00000000
CPUID 0000000B: 00000000-00000001-00000100-00000002
CPUID 0000000B: 00000002-00000004-00000201-00000002
CPUID 0000000C: 00000000-00000000-00000000-00000000
CPUID 0000000D: 00000007-00000340-00000340-00000000
CPUID 0000000D: 00000000-00000000-00000000-00000000
CPUID 0000000D: 00000100-00000240-00000000-00000000
CPUID 40000000: 40000001-4B4D564B-564B4D56-0000004D
CPUID 40000001: 01000089-00000000-00000000-00000000
CPUID 80000000: 80000008-00000000-00000000-00000000
CPUID 80000001: 00000000-00000000-00000021-28100800
CPUID 80000002: 65746E49-2952286C-726F4320-4D542865
CPUID 80000003: 37692029-3037342D-20514830-20555043
CPUID 80000004: 2E322040-48473034-0000007A-00000000
CPUID 80000005: 00000000-00000000-00000000-00000000
CPUID 80000006: 00000000-00000000-01006040-00000000
CPUID 80000007: 00000000-00000000-00000000-00000100
CPUID 80000008: 00003027-00000000-00000000-00000000
----------------------------------------------------

CPUID Registers (CPU #3):
----------------------------------------------------
Function        EAX      EBX      ECX      EDX
----------------------------------------------------
CPUID 00000000: 0000000D-756E6547-6C65746E-49656E69
CPUID 00000001: 000306C3-03040800-FEFA3203-178BFBFF
CPUID 00000002: 76036301-00F0B5FF-00000000-00C10000
CPUID 00000003: 00000000-00000000-00000000-00000000
CPUID 00000004: 0C000121-01C0003F-0000003F-00000000
CPUID 00000004: 0C000122-01C0003F-0000003F-00000000
CPUID 00000004: 0C000143-01C0003F-000001FF-00000000
CPUID 00000004: 0C000163-02C0003F-00001FFF-00000006
CPUID 00000005: 00000000-00000000-00000000-00000000
CPUID 00000006: 00000004-00000000-00000000-00000000
CPUID 00000007: 00000000-00002529-00000000-10000400
CPUID 00000008: 00000000-00000000-00000000-00000000
CPUID 00000009: 00000000-00000000-00000000-00000000
CPUID 0000000A: 00000000-00000000-00000000-00000000
CPUID 0000000B: 00000000-00000001-00000100-00000003
CPUID 0000000B: 00000002-00000004-00000201-00000003
CPUID 0000000C: 00000000-00000000-00000000-00000000
CPUID 0000000D: 00000007-00000340-00000340-00000000
CPUID 0000000D: 00000000-00000000-00000000-00000000
CPUID 0000000D: 00000100-00000240-00000000-00000000
CPUID 40000000: 40000001-4B4D564B-564B4D56-0000004D
CPUID 40000001: 01000089-00000000-00000000-00000000
CPUID 80000000: 80000008-00000000-00000000-00000000
CPUID 80000001: 00000000-00000000-00000021-28100800
CPUID 80000002: 65746E49-2952286C-726F4320-4D542865
CPUID 80000003: 37692029-3037342D-20514830-20555043
CPUID 80000004: 2E322040-48473034-0000007A-00000000
CPUID 80000005: 00000000-00000000-00000000-00000000
CPUID 80000006: 00000000-00000000-01006040-00000000
CPUID 80000007: 00000000-00000000-00000000-00000100
CPUID 80000008: 00003027-00000000-00000000-00000000
----------------------------------------------------

